{
  "$schema": "https://json-schema.org/draft/2020-12/schema",
  "title": "Document",
  "type": "object",
  "additionalProperties": false,
  "required": [
    "object_type",
    "schema_version",
    "document_id",
    "title",
    "source",
    "content",
    "content_type",
    "checksum",
    "created_at",
    "updated_at"
  ],
  "properties": {
    "object_type": { "type": "string", "enum": ["document"] },
    "schema_version": { "type": "string", "enum": ["1.0.0"] },
    "document_id": {
      "type": "string",
      "pattern": "^[0-9A-Z]{26}$|^[0-9a-fA-F-]{36}$",
      "description": "Unique identifier (ULID or UUID)."
    },
    "title": { "type": "string", "minLength": 1 },
    "source": { "type": "string", "minLength": 1 },
    "content": { "type": "string", "minLength": 1 },
    "content_type": {
      "type": "string",
      "enum": ["text/plain", "text/markdown", "text/html", "application/pdf"]
    },
    "checksum": { "type": "string", "minLength": 1 },
    "tags": { "type": "array", "items": { "type": "string" } },
    "created_at": { "type": "string", "format": "date-time" },
    "updated_at": { "type": "string", "format": "date-time" },
    "metadata": { "type": "object", "additionalProperties": true }
  }
}
